{
  "schema_version": "1.0.0",
  "reconsideration_id": "REC-2026-0019",
  "trigger": { "kind": "challenge", "ref": "CHL-2026-0088" },
  "subject": { "kind": "grant", "ref": "GRANT-2026-0142" },
  "opened_at": "2026-06-11T10:00:00Z",
  "decided_at": "2026-06-18T16:30:00Z",
  "outcome": "narrow",
  "evidence_delta": "At issue the grant assumed vulnerable-account flags were current within 24 hours and that the population scope excluded them by convention. The challenge showed the scope never stated the exclusion and the flag had been set 48 hours before the hold. The false-positive rate on flagged accounts was 11% against a 2% assumption.",
  "decided_by": "Risk Governance Board",
  "resulting_refs": ["GRANT-2026-0142", "DR-2026-0142-0931"]
}
